<?xml version="1.0" encoding="UTF-8" ?>

<!-- Created by Administrator on April 5, 2004, 11:09 AM -->

<!DOCTYPE ActuatorType [

<!-- Created by Administrator on April 2, 2004, 1:57 PM -->

<!ELEMENT ActuatorType (Action*) >
<!ATTLIST ActuatorType 
    name CDATA #REQUIRED
    affectsAssetType CDATA #REQUIRED
    affectsStateDimension CDATA #REQUIRED
>

<!ELEMENT Action (Description, Transition)  >
<!ATTLIST Action 
    value CDATA #REQUIRED
>

<!ELEMENT Transition (OneTimeCost? , ContinuingCost? )  >
<!ATTLIST Transition
    WhenActualStateIs CDATA #REQUIRED
    EndStateWillBe CDATA #REQUIRED
>

<!ELEMENT OneTimeCost (CPU?, Time?, Bandwdith?, Memory? )  >
<!ELEMENT ContinuingCost (CPU?, Time?, Bandwdith?, Memory? )  >

<!ELEMENT CPU EMPTY> 
<!ATTLIST CPU
    intensity ( NONE | VERY_LOW | LOW | MEDIUM | HIGH | VERY_HIGH ) 'NONE'
    agentSizeFactor  (true | false) 'false'
    msgSizeFactor  (true | false) 'false'
>

<!ELEMENT Bandwidth EMPTY> 
<!ATTLIST Bandwidth
    intensity ( NONE | VERY_LOW | LOW | MEDIUM | HIGH | VERY_HIGH ) 'NONE'
    agentSizeFactor  (true | false) 'false'
    msgSizeFactor  (true | false) 'false'
>

<!ELEMENT Memory EMPTY> 
<!ATTLIST Memory
    intensity ( NONE | VERY_LOW | LOW | MEDIUM | HIGH | VERY_HIGH ) 'NONE'
    agentSizeFactor  (true | false) 'false'
    msgSizeFactor  (true | false) 'false'
>

<!ELEMENT Time EMPTY> 
<!ATTLIST Time
    duration CDATA #REQUIRED
>
]>

<ActuatorType name="RestartAgent" affectsAssetType="Agent" affectsStateDimension="Liveness" />
    <Action name="LocalRestart">
        <Description value="Restarts agent in node on local host" />
        <Transition WhenActualStateIs="*" EndStateWillBe="LIVE" />
            <OneTimeCost>
                <CPU intensity="HIGH" agentSizeFactor="TRUE" />
            </OneTimeCost>
            <ContinuingCost>
                <CPU intensity="MEDIUM" msgSizeFactor="TRUE" />
            </ContinuingCost>
        </Transition>
    </Action>
    
    <Action name="QuickRemoteRestart">
        <Description value="Restarts agent in first available node" />
        <Transition WhenActualStateIs="*" EndStateWillBe="LIVE" />
            <OneTimeCost>
                <CPU intensity="HIGH" agentSizeFactor="TRUE" />
                <Bandwidth intensity="MEDIUM" agentSizeFactor="TRUE" />
            </OneTimeCost>
        </Transition>
    </Action>

    <Action name="BalancingRestart">
        <Description value="Restarts multiple agents with a rebalancing plan" />
        <Transition WhenActualStateIs="*" EndStateWillBe="LIVE" />
            <OneTimeCost>
                <Time duration="120" />
                <CPU intensity="HIGH" agentSizeFactor="TRUE" />
                <Bandwidth intensity="MEDIUM" agentSizeFactor="TRUE" />
            </OneTimeCost>
        </Transition>
    </Action>
</ActuatorType>